question,answer
"How do I log in to BluCygnus AI?","Visit https://staging.blucygnus.ai/, click the Log In button, enter your registered email and password, and click Submit. If enabled, complete two-factor authentication (2FA) using your phone or authenticator app."
"How do I sign up for the BluCygnus AI staging site?","Go to https://staging.blucygnus.ai/, click Sign Up for Beta Access, provide your email, create a password, and optionally enter your name and organization. Check your inbox for a verification email and click the link to activate your account."
"What should I do if I forget my password?","On the login page at https://staging.blucygnus.ai/, click Forgot Password, enter your registered email, and submit. You will receive a reset link in your email. Click it, create a new password, and log in."
"What is BluCygnus AI, and how can it benefit my business?","BluCygnus AI is a cutting-edge platform that leverages artificial intelligence to provide data analytics, automation, and predictive insights. For businesses, it streamlines operations by automating repetitive tasks, offers real-time data visualization for informed decision-making, and provides predictive models to forecast trends, helping small businesses, enterprises, and individual professionals boost productivity and efficiency."
"What is the purpose of the staging site at https://staging.blucygnus.ai/?","The staging site is a pre-release testing environment where users can explore experimental features, such as natural language querying or advanced AI models, before they are finalized for the live platform. It is designed to gather user feedback to improve functionality, ensuring the official launch delivers a polished experience."
"Who is the target audience for BluCygnus AI?","BluCygnus AI serves a diverse audience, including small business owners needing automation, data analysts seeking advanced insights, developers integrating AI into apps, and enterprises requiring scalable solutions. It is also ideal for professionals in marketing, finance, or operations who want to leverage AI without deep technical expertise."
"What do I need to create an account on the staging site?","You will need a valid email address and a password. Optionally, you can provide your name and organization details during signup to personalize your experience. No payment information is required for beta access."
"How do I purchase a BluCygnus AI subscription plan?","While the staging site is free for beta testing, paid plans will be available upon the live site’s launch. To purchase, log into your account, navigate to the Pricing or Billing section, select a plan (e.g., Basic, Pro, or Enterprise), and enter payment details like a credit card or digital wallet. Check the live site for exact steps post-launch."
"What are the available pricing plans for BluCygnus AI?","The platform offers a free tier for basic usage during the beta phase. Post-launch, paid plans (e.g., Basic, Pro, Enterprise) will provide advanced features like higher API limits, larger storage, and priority support. Exact pricing details will be available on the live site."
"Is there a free trial for paid plans?","A 14-day free trial for paid plans is planned for the live site. During the trial, you can access premium features without upfront payment, and no charges apply if you cancel before the trial ends."
"How do I upgrade from a free to a paid plan?","Once the live site launches, go to the Account Settings or Billing section in your dashboard, select the desired paid plan, and follow the prompts to enter payment information. Your account will upgrade instantly, granting access to premium features."
"Can I cancel my subscription, and how?","Yes, subscriptions can be canceled post-launch via the Billing section in your account settings. Select Cancel Subscription, confirm your choice, and your plan will not renew. Access to paid features continues until the billing cycle ends."
"What payment methods does BluCygnus AI accept?","Upon launch, the platform will accept major credit cards (Visa, MasterCard, Amex) and select digital wallets (e.g., PayPal, Apple Pay). Check the live site for a complete list."
"Are there discounts for annual subscriptions?","Yes, annual subscriptions will offer cost savings compared to monthly billing, typically 10-20% off. Details will be available in the Pricing section post-launch."
"How do I access the BluCygnus AI dashboard?","After signing up and logging in at https://staging.blucygnus.ai/, you will be directed to the dashboard, where you can upload data, explore analytics, set up automations, and manage your account. Use the sidebar to navigate features."
"What types of data can I upload to BluCygnus AI?","You can upload structured data (e.g., CSV, Excel, JSON) for analytics and automation, as well as unstructured data like text files or images (in beta) for NLP or image analysis tasks."
"How do I upload data to the platform?","Log into the dashboard, click Upload Data in the sidebar, select your file (e.g., CSV, Excel), and follow the prompts to map columns or configure settings. The platform supports drag-and-drop uploads for ease."
"What is the maximum file size for data uploads?","The staging site supports files up to 100 MB. Larger files may be supported in paid plans post-launch; check documentation for updates."
"How do I create a custom dashboard for my data?","In the dashboard, select Create Dashboard, choose a template or start from scratch, and drag-and-drop widgets (e.g., charts, tables) to visualize your data. Customize colors, filters, and layouts to suit your needs."
"What is real-time analytics, and how does it work?","Real-time analytics processes data as it is uploaded, providing instant visualizations like graphs or heatmaps. In the dashboard, enable Real-Time Mode for supported datasets to monitor live updates, ideal for time-sensitive insights."
"How do I set up an automation workflow?","Navigate to the Automation tab, click New Workflow, select a trigger (e.g., new data upload), define actions (e.g., generate report, send email), and save. Test the workflow to ensure it runs as expected."
"What types of tasks can I automate with BluCygnus AI?","You can automate repetitive tasks like generating daily reports, sending customer notifications, updating CRM records, or scheduling social media posts, saving time and reducing manual effort."
"How do I integrate BluCygnus AI with third-party tools?","In the dashboard, go to Integrations, select a supported tool (e.g., Slack, Google Sheets), and authenticate using your credentials. Follow the prompts to link accounts and configure data flows."
"What tools does BluCygnus AI integrate with?","The platform supports integrations with Google Workspace, Slack, Salesforce, HubSpot, and other CRM or productivity tools. More integrations, like Zapier, are planned for the live site."
"How do I use the natural language querying feature?","In the dashboard, select Query Data, type a question in plain English (e.g., Show sales trends for 2025), and the AI will interpret and display results as charts or tables. This feature is in beta on the staging site."
"Can I use BluCygnus AI without technical skills?","Yes, the platform is designed with intuitive interfaces, drag-and-drop tools, and guided setups, making it accessible for non-technical users like marketers or business owners."
"How do developers use the BluCygnus AI API?","Developers can access the API by generating a key in the Developer Settings section. Use the key to make calls for data processing, model training, or automation tasks. Documentation is available in the help center."
"What programming languages are supported for scripting?","The beta environment supports Python and JavaScript for custom scripts, accessible via the Scripting tab for advanced users."
"How do I test AI models on the staging site?","In the AI Models section, select a pre-built model (e.g., predictive analytics) or upload a custom dataset to test. Adjust parameters and review outputs in the dashboard."
"What types of AI models are available on BluCygnus AI?","Available models include machine learning for predictive analytics, natural language processing for text analysis, and image recognition (in beta) for tasks like object detection."
"Can I train my own AI models?","Custom model training is in beta for enterprise users. Upload a dataset, select a model type, and configure training parameters in the AI Models section."
"How accurate are BluCygnus AI’s predictive models?","Accuracy varies by data quality but is optimized using advanced algorithms. For example, sales forecasting models achieve up to 85-95% accuracy with clean, comprehensive data."
"How do I use BluCygnus AI for image analysis?","In the beta environment, upload images via the Image Analysis tool, select a task (e.g., object detection), and review AI-generated results. This feature is experimental and may have limitations."
"How do I collaborate with my team on BluCygnus AI?","Invite team members via Team Settings, assign roles (e.g., Admin, Editor), and share dashboards or projects. Collaborate in real-time with version control for data edits."
"How do I invite team members to my account?","In the dashboard, go to Team Settings, click Invite Member, enter their email, and assign a role. They will receive an invitation to join your workspace."
"What is role-based access control (RBAC)?","RBAC lets you assign permissions (e.g., Viewer, Editor, Admin) to team members, controlling who can view, edit, or manage projects, ensuring secure collaboration."
"Is there a limit to how many team members I can invite?","The staging site supports up to 10 team members in the free tier. Enterprise plans will offer higher limits post-launch."
"How secure is my data on BluCygnus AI?","Your data is protected with AES-256 encryption at rest, TLS 1.3 for data in transit, and regular security audits. The platform complies with GDPR and other privacy regulations."
"Who owns the data I upload to BluCygnus AI?","You retain full ownership of your data. BluCygnus AI does not sell, share, or use your data for purposes beyond providing services."
"Does BluCygnus AI comply with data privacy laws?","Yes, the platform adheres to GDPR, CCPA, and other global privacy standards, ensuring your data is handled responsibly."
"How do I enable two-factor authentication (2FA)?","In Account Settings, select Security, enable 2FA, and follow the prompts to link your phone or authenticator app for added login protection."
"Can I export my data or results from BluCygnus AI?","Yes, go to the Export option in the dashboard, select your data or visualization, and choose a format like CSV, PDF, or JSON for download."
"What is the data retention policy for BluCygnus AI?","Data is retained as long as your account is active. If you delete your account, data is purged after a 30-day grace period unless otherwise requested."
"How do I delete my data from BluCygnus AI?","In Account Settings, select Delete Account, confirm your choice, and your data will be scheduled for deletion within 30 days. Contact support for immediate deletion."
"What happens to my data after the beta phase?","Beta data may be reset before the live launch. You will be notified in advance and can export your data to avoid loss."
"How do I provide feedback on the staging site?","Use the Feedback form in the dashboard or email feedback@blucygnus.ai with your suggestions, bug reports, or feature requests."
"How does BluCygnus AI use my feedback?","Feedback is reviewed by the development team to fix bugs, improve usability, and prioritize new features, ensuring the platform meets user needs."
"What browsers are supported by the staging site?","The platform is fully compatible with Chrome, Firefox, Safari, and Edge. Ensure your browser is updated for the best experience."
"Is there a mobile app for BluCygnus AI?","A mobile app is in development. For now, the staging site is mobile-responsive, accessible via browsers on iOS and Android devices."
"Can I use BluCygnus AI offline?","No, an internet connection is required, as the platform relies on cloud-based processing for analytics and automation."
"What is the uptime guarantee for the staging site?","As a beta environment, uptime is not guaranteed but typically exceeds 99%. The live site will target 99.9% uptime."
"How often are new features added to the staging site?","New features are rolled out approximately every two weeks during the beta phase, based on user feedback and development priorities."
"How do I request a specific feature for BluCygnus AI?","Submit your request via the in-app feedback form or email feedback@blucygnus.ai, describing the feature and its use case."
"What support options are available for beta users?","Support includes an in-app help center, email (support@blucygnus.ai), live chat (beta hours: 9 AM-5 PM EST), and a community forum for peer assistance."
"How do I access the help center?","Click the Help icon in the dashboard to access guides, tutorials, and FAQs covering common tasks and troubleshooting."
"What are the support hours for the staging site?","Beta support is available from 9 AM to 5 PM EST, Monday through Friday, via live chat or email."
"How do I join the BluCygnus AI community forum?","Access the forum via the Community link in the dashboard, where you can post questions, share tips, and connect with other beta users."
"Are there training resources for new users?","Yes, the help center offers video tutorials, step-by-step guides, and monthly webinars to help you master the platform."
"How do I sign up for a live training webinar?","Check the Events section in the dashboard or subscribe to the newsletter for webinar schedules and registration links."
"Can I schedule a demo for my team?","Enterprise users can request a personalized demo by emailing sales@blucygnus.ai, specifying your team’s needs and preferred time."
"How do I contact the BluCygnus AI team for partnerships?","Email partnerships@blucygnus.ai with details about your proposed collaboration, including your organization and goals."
"What is the roadmap for BluCygnus AI’s development?","The roadmap includes enhanced NLP, additional integrations (e.g., Zapier), mobile apps, and advanced AI model customization, with updates shared via the help center."
"How do I stay updated on new features and launches?","Subscribe to the newsletter via the Settings page or follow BluCygnus AI on social media platforms like Twitter and LinkedIn."
"Does BluCygnus AI support multiple languages for the interface?","The beta interface supports English, Spanish, and French, with more languages planned for the live site."
"Can I process non-English data on the platform?","Yes, NLP models support languages like Spanish, German, and French for text analysis, with more languages in development."
"How do I use BluCygnus AI for sales forecasting?","Upload your sales data (e.g., CSV), select the Predictive Analytics tool, choose a forecasting model, and review the generated trends and predictions."
"Can I perform sentiment analysis with BluCygnus AI?","Yes, upload text data (e.g., customer reviews) to the NLP Analysis tool, select Sentiment Analysis, and view results as positive, negative, or neutral."
"How do I set up A/B testing for marketing campaigns?","In the beta Marketing Analytics tool, upload campaign data, define test variables (e.g., ad copy), and compare performance metrics like click-through rates."
"What is the maximum API call limit for beta users?","Beta users can make up to 1,000 API calls per month in the free tier. Higher limits will be available in paid plans."
"How do I generate an API key?","In the dashboard, go to Developer Settings, click Generate API Key, and copy the key for use in your applications."
"What happens if I exceed my API call limit?","Free tier users may face temporary restrictions. Upgrade to a paid plan for higher limits or contact support for assistance."
"Can I use BluCygnus AI for academic research?","Yes, researchers can upload datasets, run analytics, and visualize results for studies in fields like economics, social sciences, or AI development."
"Are there discounts for students or educators?","Student and educator discounts will be available post-launch. Verify eligibility with a .edu email in the Pricing section."
"How do I schedule automated reports?","In the Automation tab, create a workflow, set a trigger (e.g., daily at 8 AM), and configure the report format and delivery method (e.g., email, download)."
"Can I use BluCygnus AI for customer support automation?","Yes, set up AI chatbots in the Automation tab to handle inquiries via integrations with tools like Slack or email platforms."
"Does BluCygnus AI support time-series analysis?","Yes, upload time-series data (e.g., stock prices), select the Time-Series Analysis tool, and generate forecasts or trend visualizations."
"How do I report a bug on the staging site?","Use the Feedback form in the dashboard or email support@blucygnus.ai with a description of the issue, including screenshots if possible."
"What is the latency for real-time analytics?","For standard datasets, real-time analytics typically process data in under 1 second, ensuring fast insights for live monitoring."
"Can I customize AI model parameters?","Advanced users can adjust parameters like learning rate or epochs in the AI Models section via the API or scripting tools."
"What is the maximum data storage limit?","The free tier offers 5 GB of storage. Paid plans will provide higher limits, detailed post-launch."
"How does BluCygnus AI handle large datasets?","The platform uses AWS cloud infrastructure to scale processing, ensuring efficient handling of datasets up to several gigabytes."
"Can I host BluCygnus AI on-premises?","Enterprise users can request on-premises deployment by contacting sales@blucygnus.ai for custom setup and pricing."
"Does BluCygnus AI offer consulting services?","Yes, enterprise clients can access AI consulting for custom solutions, such as model development or workflow optimization. Email sales@blucygnus.ai."
"Is there a referral program for BluCygnus AI?","A referral program is planned for the live site, allowing users to earn credits or discounts by inviting others."
"How do I access the public roadmap?","The roadmap is available in the help center under Development Updates, outlining upcoming features and timelines."
"Can I use BluCygnus AI for social media analytics?","Yes, integrate with platforms like Twitter, upload post data, and use NLP tools to analyze engagement, sentiment, or trends."
"Does the platform support voice commands?","Voice command support is in development and expected in a future release for hands-free operation."
"How do I troubleshoot upload errors?","Check file format and size compatibility, ensure a stable internet connection, and review error messages. Contact support if issues persist."
"What is the process for handling feature requests?","Feature requests are submitted via the feedback form, reviewed biweekly by the team, and prioritized based on user demand and feasibility."
"Is BluCygnus AI accessible for users with disabilities?","The platform follows WCAG 2.1 guidelines, offering features like screen reader support and keyboard navigation."
"Can I use BluCygnus AI for financial modeling?","Yes, upload financial data, select Predictive Analytics, and use models for tasks like cash flow forecasting or risk analysis."
"How do I monitor my usage limits?","Check the Account Usage section in the dashboard for details on API calls, storage, and other metrics."
"What happens if I encounter a bug during beta testing?","Report the bug via the feedback form with details like steps to reproduce and device information. The team will investigate promptly."
"Can I integrate BluCygnus AI with Zapier?","Zapier integration is planned for the live site, enabling connections with thousands of apps for enhanced automation."
"How do I back up my data on BluCygnus AI?","Export your data regularly using the Export feature to save copies locally as CSV, JSON, or PDF."
"What cloud infrastructure powers BluCygnus AI?","The platform runs on AWS, ensuring scalability, security, and high availability for all users."
"Can I use BluCygnus AI for predictive maintenance?","Yes, upload equipment data, select a predictive model, and generate maintenance schedules based on failure predictions."
"What is the process for enterprise onboarding?","Contact sales@blucygnus.ai to discuss needs, schedule a demo, and set up a custom plan with dedicated support and training."
"Can I use BluCygnus AI for inventory management?","Yes, upload inventory data and use automation or analytics tools to track stock levels and predict reorder needs."
"How do I access beta testing tools?","In the dashboard, enable Beta Features to test advanced tools like advanced NLP or image analysis, and provide feedback."
"What should I do if I do not receive the verification email?","Wait 5-10 minutes, check your spam/junk folder, and ensure you entered the correct email. If the issue persists, request a new verification email via the login page or contact support@blucygnus.ai."
"Can I change my email address after signing up?","Yes, go to Account Settings in the dashboard, select Change Email, enter a new email, and verify it via a confirmation link sent to the new address."
"How do I update my account information, like my name or organization?","In the dashboard, navigate to Account Settings, edit fields like name or organization, and click Save to update your profile."
"What is the difference between a free and paid account on BluCygnus AI?","A free account offers basic features like limited data uploads and API calls, while paid accounts (post-launch) provide higher storage, advanced analytics, and priority support."
"How do I know which BluCygnus AI plan is right for me?","Assess your needs: free plans suit individual testing, Basic/Pro plans are for small teams needing automation, and Enterprise plans support large-scale analytics. Check the Pricing page post-launch for details."
"Can I downgrade my plan after upgrading?","Yes, post-launch, go to Billing in the dashboard, select a lower-tier plan, and confirm. Changes take effect at the end of your billing cycle."
"How do I check my billing history?","Once paid plans are available, view your billing history in the Billing section of the dashboard, showing invoices, payment dates, and plan details."
"What happens if my payment fails?","You will receive an email notification to update your payment method. Access Billing in the dashboard to add a new card or retry payment to avoid service interruption."
"Can I use BluCygnus AI for personal projects?","Yes, the free tier is ideal for personal projects like analyzing hobby datasets or testing automation workflows, with easy-to-use tools for non-professionals."
"How do I create a new project in BluCygnus AI?","In the dashboard, click New Project, name it, select a template (e.g., analytics, automation), and start adding data or workflows."
"Can I duplicate an existing project?","Yes, in the Projects tab, select a project, click Duplicate, and rename it to create a copy with the same settings and data."
"How do I delete a project?","In the Projects tab, select the project, click Delete, and confirm. Note that deleted projects cannot be recovered unless exported beforehand."
"What is the data import wizard in BluCygnus AI?","The import wizard guides you through uploading data, mapping columns, and cleaning datasets (e.g., removing duplicates) for seamless analysis. Access it via Upload Data."
"How do I clean my uploaded data?","During upload, use the data import wizard to remove duplicates, fill missing values, or standardize formats. Advanced cleaning is available in the Data Prep tool."
"Can I schedule data uploads?","Yes, in the Automation tab, create a workflow to periodically pull data from integrated sources (e.g., Google Drive) for automatic uploads."
"How do I share a dashboard with external stakeholders?","In the dashboard, select Share, generate a secure link with view-only access, and send it to stakeholders. Links can be password-protected."
"What types of visualizations can I create?","You can create bar charts, line graphs, pie charts, heatmaps, and scatter plots, customizable with filters and colors in the dashboard."
"How do I filter data in a visualization?","In the dashboard editor, select a visualization, click Add Filter, and choose criteria (e.g., date range, category) to refine displayed data."
"Can I combine multiple datasets in one visualization?","Yes, use the Data Merge tool in the dashboard to join datasets by common fields, then visualize the combined data in a single chart."
"How do I create a predictive model for my data?","In the AI Models section, upload your dataset, select Predictive Model, choose a template (e.g., regression), and configure parameters to generate forecasts."
"What is the difference between supervised and unsupervised models?","Supervised models use labeled data to predict outcomes (e.g., sales forecasts), while unsupervised models find patterns (e.g., clustering customers) without predefined labels."
"Can I export my predictive model results?","Yes, after running a model, click Export Results to download predictions as CSV or JSON for further analysis."
"How do I validate the accuracy of my predictive model?","In the AI Models section, view the model’s performance metrics (e.g., RMSE, accuracy) and test it on a holdout dataset to ensure reliability."
"What is the automation trigger feature?","Triggers initiate workflows based on events, like new data uploads or time schedules, automating tasks like report generation or notifications."
