question,answer
"How do I set up email notifications for workflows?","In the Automation tab, add an Email action to your workflow, configure recipients, and customize the message to send updates or alerts."
"Can I pause or edit an active workflow?","Yes, in the Automation tab, select the workflow, click Pause to stop it, or Edit to modify triggers, actions, or settings."
"How do I troubleshoot a failed workflow?","Check the workflow logs in the Automation tab for error details, verify data inputs, and ensure integrations are active. Contact support if needed."
"What is the maximum number of workflows I can create?","The free tier allows up to 5 active workflows; paid plans will offer higher limits post-launch."
"How do I integrate BluCygnus AI with Google Sheets?","In Integrations, select Google Sheets, authenticate with your Google account, and map the spreadsheet to pull or push data automatically."
"Can I use BluCygnus AI with Microsoft Excel?","Yes, export Excel files as CSV or use the Office 365 integration (planned for live site) to connect directly with Excel online."
"How do I set up a Slack integration?","In Integrations, choose Slack, log in to your workspace, and configure notifications or data-sharing settings for real-time updates."
"What is the benefit of integrating with a CRM like Salesforce?","CRM integration allows you to pull customer data for analysis, automate lead updates, or trigger personalized campaigns directly from BluCygnus AI."
"How do I test an integration before activating it?","In the Integrations tab, use the Test Connection option to verify authentication and data flow without affecting live data."
"Can I create custom integrations?","Developers can use the API to build custom integrations, detailed in the developer documentation in the help center."
"How do I use natural language querying for complex questions?","In the Query Data tool, type detailed questions (e.g., What are my top 5 products by sales in Q1 2025?), and the AI will parse and visualize the answer."
"What happens if the natural language query misinterprets my question?","Refine your query with specific terms or use the query editor to manually adjust filters. Feedback helps improve the feature during beta."
"Can I save frequently used queries?","Yes, after running a query, click Save Query to store it for quick access in the Saved Queries section."
"How do I use BluCygnus AI for text analysis?","Upload text data, select NLP Analysis, choose tasks like keyword extraction or sentiment analysis, and review results in the dashboard."
"What is sentiment analysis, and how is it useful?","Sentiment analysis evaluates text (e.g., reviews) to determine positive, negative, or neutral tones, helping businesses gauge customer satisfaction."
"Can I analyze social media posts with BluCygnus AI?","Yes, integrate with platforms like Twitter, upload post data, and use NLP tools to analyze engagement, sentiment, or trends."
"How do I use image analysis in the beta phase?","Upload images to the Image Analysis tool, select a task (e.g., object detection), and view results. Note that beta features may have limited accuracy."
"What types of images are supported for analysis?","The beta supports JPEG and PNG formats, with a maximum size of 10 MB per image."
"How do I manage team permissions effectively?","In Team Settings, assign roles (Viewer, Editor, Admin) based on tasks, ensuring sensitive data access is restricted to authorized users."
"Can I revoke a team member’s access?","Yes, in Team Settings, select the member, click Remove, and confirm to revoke their access instantly."
"How do I monitor team activity on the platform?","Admins can view activity logs in Team Settings to track actions like data uploads, edits, or workflow changes."
"What is the secure collaboration feature?","It allows teams to work on shared projects with role-based access, version control, and encrypted data sharing to ensure privacy and coordination."
"How do I recover a deleted dashboard?","Deleted dashboards cannot be recovered unless previously exported. Contact support within 30 days for possible data restoration."
"Can I set up alerts for specific data thresholds?","Yes, in the Automation tab, create a workflow with a threshold trigger (e.g., sales below $10,000) to send alerts via email or Slack."
"How do I optimize my dataset for faster processing?","Remove unnecessary columns, reduce file size, and use clean, structured formats like CSV to improve processing speed."
"What is the difference between real-time and batch processing?","Real-time processing updates visualizations instantly as data streams in, while batch processing analyzes larger datasets in scheduled intervals."
"How do I enable real-time processing for my data?","In the dashboard, select your dataset, enable Real-Time Mode, and ensure it is compatible with streaming data sources."
"Can I use BluCygnus AI for competitor analysis?","Yes, upload competitor data (e.g., pricing, reviews), and use analytics tools to compare performance metrics or sentiment."
"How do I create a report from my analysis?","In the dashboard, select Generate Report, choose visualizations or data tables, customize the layout, and export as PDF or CSV."
"Can I automate report sharing with my team?","Yes, create a workflow in the Automation tab to schedule and email reports to team members or stakeholders."
"What is the maximum report size I can export?","Reports are limited to 50 MB in the beta phase. Compress large datasets or split reports for larger outputs."
"How do I use BluCygnus AI for supply chain optimization?","Upload supply chain data, use predictive models to forecast demand, and automate inventory alerts for efficient management."
"Can I integrate BluCygnus AI with my ERP system?","ERP integrations (e.g., SAP, Oracle) are planned for the live site. Use the API for custom ERP connections in beta."
"How do I handle large API responses?","Paginate API calls or filter responses using query parameters to manage large datasets efficiently, as outlined in the API documentation."
"What is the rate limit for API calls?","The beta free tier allows 1,000 calls per month, with throttling applied if exceeded. Paid plans will offer higher limits."
"How do I secure my API key?","Store your API key securely, avoid sharing it publicly, and regenerate it in Developer Settings if compromised."
"Can I use BluCygnus AI for fraud detection?","Yes, upload transaction data, apply anomaly detection models in the AI Models section, and flag suspicious activities."
"How do I analyze customer churn with BluCygnus AI?","Upload customer data, use predictive models to identify churn risks, and visualize retention trends in the dashboard."
"What is the data preprocessing tool?","The preprocessing tool cleans data by handling missing values, normalizing formats, or removing outliers before analysis, accessible via Data Prep."
"Can I undo changes made during data preprocessing?","Yes, the platform saves a version history in the Data Prep tool, allowing you to revert to previous dataset versions."
"How do I use BluCygnus AI for HR analytics?","Upload employee data, analyze metrics like turnover or performance, and use predictive models to forecast hiring needs."
"Can I create custom metrics for my analysis?","Yes, in the dashboard, define custom metrics (e.g., revenue per customer) using the Custom Calculations tool."
"How do I handle time zone differences in data?","During data upload, specify the time zone in the import wizard to standardize timestamps for accurate analysis."
"Can I use BluCygnus AI for real-time stock market analysis?","Yes, connect to a supported data feed via API, enable real-time mode, and visualize stock trends or run predictive models."
"How do I set up a recurring data sync?","In the Integrations tab, configure a data source (e.g., Google Drive) and schedule syncs in the Automation tab for periodic updates."
"What is the maximum number of dashboards I can create?","The free tier allows up to 3 dashboards; paid plans will support more, detailed post-launch."
"Can I customize the appearance of my dashboards?","Yes, in the dashboard editor, adjust colors, fonts, and layouts to match your branding or preferences."
"How do I share my API key with my team safely?","Avoid sharing directly; instead, create separate API keys for team members in Developer Settings with restricted permissions."
"Can I use BluCygnus AI for marketing campaign tracking?","Yes, integrate with marketing platforms, upload campaign data, and track metrics like ROI or click-through rates in the dashboard."
"How do I analyze website traffic data?","Connect to Google Analytics via integration, import traffic data, and use analytics tools to visualize visitor trends or behavior."
"What is the benefit of version control in projects?","Version control tracks changes to datasets or dashboards, allowing you to revert to earlier versions or audit edits for collaboration."
"How do I enable version control for my project?","In the Project Settings, toggle Enable Version Control to track changes automatically for data and dashboards."
"Can I use BluCygnus AI for A/B testing website designs?","Yes, upload design performance data, use the Marketing Analytics tool, and compare metrics like conversion rates for A/B tests."
"How do I handle duplicate data entries?","During data upload, enable Remove Duplicates in the import wizard or use the Data Prep tool to clean duplicates post-upload."
"What is the maximum team size for collaboration?","The beta free tier supports up to 10 team members. Enterprise plans will allow larger teams post-launch."
"Can I export my project settings?","Yes, in the Projects tab, select Export Settings to save configurations as a JSON file for reuse or backup."
"How do I import a saved project template?","In the Projects tab, click Import Template, upload a JSON file with saved settings, and apply it to a new project."
"Can I use BluCygnus AI for predictive budgeting?","Yes, upload financial data, select a forecasting model, and generate budget predictions based on historical trends."
"How do I manage high data upload volumes?","Use batch uploads for large datasets, compress files, and schedule uploads during off-peak hours to optimize performance."
"What is the data encryption standard for BluCygnus AI?","The platform uses AES-256 for data at rest and TLS 1.3 for data in transit, ensuring robust security."
"Can I request a security audit report?","Enterprise users can request a summary of security practices by contacting sales@blucygnus.ai."
"How do I set up multi-factor authentication for my team?","In Team Settings, enable MFA for all members, requiring them to set up 2FA via phone or authenticator apps."
"What is the process for resolving login errors?","Clear browser cache, try a different browser, or reset your password. If unresolved, email support@blucygnus.ai with error details."
"Can I use BluCygnus AI for real-time customer feedback analysis?","Yes, integrate with feedback tools, upload responses, and use NLP to analyze sentiment or identify trends in real time."
"How do I optimize API performance for large datasets?","Use pagination, filter queries, and cache responses locally to reduce API load, as detailed in the developer documentation."
"What is the error handling process for API calls?","Check error codes in API responses, review logs in Developer Settings, and consult documentation for specific error resolutions."
"Can I use BluCygnus AI for healthcare data analysis?","Yes, upload anonymized patient data, ensure compliance with regulations like HIPAA, and analyze trends or predict outcomes."
"How do I ensure compliance with data regulations?","Use the platform’s GDPR and CCPA-compliant features, anonymize sensitive data, and consult the help center for compliance guides."
"Can I create a custom workflow for data validation?","Yes, in the Automation tab, set up a workflow to check data quality (e.g., missing values) before processing."
"How do I monitor my project’s performance metrics?","In the Projects tab, view metrics like processing time, data volume, or workflow success rates in the analytics overview."
"Can I use BluCygnus AI for e-commerce analytics?","Yes, upload sales and customer data, analyze purchasing patterns, and use predictive models to optimize pricing or inventory."
"How do I handle slow dashboard loading times?","Reduce dataset size, limit visualizations, or upgrade to a paid plan for faster processing. Contact support for persistent issues."
"What is the process for onboarding new team members?","Invite them via Team Settings, assign roles, and share onboarding tutorials from the help center to get them started."
"Can I use BluCygnus AI for environmental data analysis?","Yes, upload environmental datasets (e.g., climate data), use time-series models to predict trends, and visualize results."
"How do I access advanced analytics features in the beta phase?","In the dashboard, enable Beta Features to test advanced tools like multi-model AI or custom scripting, and provide feedback."
"Can I use BluCygnus AI on a tablet or smartphone?","Yes, the staging site is mobile-responsive and works on tablets and smartphones via supported browsers like Chrome or Safari, though some features may be limited on smaller screens."
"How do I troubleshoot a slow login process?","Ensure a stable internet connection, disable browser extensions, or try incognito mode. If issues persist, contact support@blucygnus.ai with details."
"Can I import data from cloud storage services?","Yes, integrate with services like Google Drive or Dropbox in the Integrations tab to import data directly into BluCygnus AI."
"How do I export my entire project?","In the Projects tab, select Export Project, choose a format (e.g., ZIP containing CSV and settings), and download all project data and configurations."
"Can I set up custom alerts for API usage?","Yes, in the Automation tab, create a workflow with a trigger for API usage thresholds (e.g., 80% of limit) to receive email or Slack alerts."
"How do I handle missing data in my datasets?","Use the Data Prep tool to impute missing values with methods like mean, median, or custom rules, or exclude incomplete records during preprocessing."
"Can I use BluCygnus AI for geospatial analysis?","Yes, upload geospatial data (e.g., coordinates in CSV), select Geospatial Analysis in beta, and visualize data on maps or analyze location-based trends."
"How do I create a multi-user workflow?","In the Automation tab, design a workflow with role-based actions (e.g., Editor approves, Admin publishes) to enable collaborative task automation."
"What is the maximum number of API keys I can generate?","The free tier allows up to 2 API keys per account; paid plans will support more, detailed post-launch."
"How do I rotate my API key?","In Developer Settings, select an existing API key, click Rotate, and confirm to generate a new key while invalidating the old one."
"Can I use BluCygnus AI for real-time IoT data analysis?","Yes, connect IoT devices via API, enable real-time mode, and visualize sensor data or run predictive models for real-time insights."
"How do I set up a custom data connector?","Use the API to create a custom connector in Developer Settings, following the documentation to link external data sources."
"What is the benefit of predictive analytics for small businesses?","Predictive analytics helps small businesses forecast sales, optimize inventory, or identify customer trends, enabling data-driven decisions with limited resources."
"How do I analyze customer segmentation?","Upload customer data, use Clustering Models in the AI Models section to group customers by behavior, and visualize segments in the dashboard."
"Can I use BluCygnus AI for anomaly detection?","Yes, upload time-series or transactional data, select Anomaly Detection in the AI Models section, and identify outliers for fraud or error detection."
"How do I create a dashboard template?","In the dashboard editor, design a dashboard, save it as a template in Dashboard Settings, and reuse it for new projects."
"Can I schedule dashboard updates?","Yes, in the Automation tab, set up a workflow to refresh dashboard data at regular intervals (e.g., hourly, daily)."
"How do I manage multiple projects efficiently?","Use the Projects tab to organize projects into folders, assign tags, and filter by status or owner for streamlined management."
"Can I use BluCygnus AI for educational purposes?","Yes, educators can use the platform to teach data analysis or AI concepts, with free tier access suitable for classroom projects."
"How do I analyze survey data with BluCygnus AI?","Upload survey responses (e.g., CSV), use NLP Analysis for open-ended questions or Analytics for quantitative data, and visualize results."
"What is the benefit of real-time collaboration?","Real-time collaboration allows team members to edit dashboards or datasets simultaneously, with changes synced instantly for efficient teamwork."
"How do I set up a data quality check?","In the Data Prep tool, enable automated checks for duplicates, missing values, or format errors before analysis or visualization."
"Can I use BluCygnus AI for predictive hiring?","Yes, upload candidate or employee data, use predictive models to assess hiring needs, and visualize recruitment trends."
"How do I create a custom report template?","In the Reports section, design a report with desired visualizations, save it as a template, and reuse it for recurring reports."
"What is the maximum number of reports I can generate?","The free tier allows up to 10 reports per month; paid plans will offer higher limits post-launch."
"How do I handle large image datasets for analysis?","Compress images to meet the 10 MB limit, use batch uploads, and process in smaller subsets to optimize performance."
"Can I use BluCygnus AI for content recommendation systems?","Yes, upload user interaction data, apply recommendation models in the AI Models section, and generate personalized content suggestions."
"How do I integrate BluCygnus AI with email marketing platforms?","Use integrations like Mailchimp (planned for live site) or the API to sync customer data and automate email campaign analytics."
"What is the benefit of automated data cleaning?","Automated data cleaning saves time by handling missing values, duplicates, or inconsistencies, ensuring high-quality data for analysis."
"How do I set up a recurring data export?","In the Automation tab, create a workflow to export data (e.g., CSV) to a cloud storage service or email at scheduled intervals."
"Can I use BluCygnus AI for risk assessment?","Yes, upload risk-related data (e.g., financial, operational), apply predictive models, and visualize risk probabilities in the dashboard."
"How do I analyze performance metrics for my workflows?","In the Automation tab, view workflow logs and metrics like execution time, success rate, or errors to optimize performance."
"What is the benefit of custom scripting in BluCygnus AI?","Custom scripting (Python, JavaScript) allows advanced users to create tailored analytics or automation logic beyond standard tools."
"How do I share a project with external clients?","In the Projects tab, generate a shareable link with view-only access, set an optional password, and send it to clients."
"Can I use BluCygnus AI for energy consumption analysis?","Yes, upload energy usage data, use time-series analysis to identify patterns, and predict future consumption for optimization."
"How do I set up a custom visualization style?","In the dashboard editor, select Custom Styles, adjust fonts, colors, and chart types, and save for consistent branding."
"What is the maximum number of data sources I can connect?","The free tier supports up to 5 data sources; paid plans will allow more, detailed post-launch."
"Can I use BluCygnus AI for demand forecasting?","Yes, upload historical sales or market data, select a forecasting model, and generate demand predictions for planning."
"How do I handle multi-language text analysis?","Upload multi-language text, select NLP Analysis, and choose supported languages (e.g., Spanish, German) for sentiment or keyword extraction."
"What is the benefit of role-based workflows?","Role-based workflows ensure tasks are assigned based on permissions, streamlining collaboration and maintaining data security."
"How do I create a backup of my dashboards?","In the Dashboards tab, select Export Dashboard to save visualizations and settings as a JSON file for backup."
"Can I use BluCygnus AI for quality control analysis?","Yes, upload production data, use anomaly detection models to identify defects, and visualize quality trends."
"How do I set up a custom data transformation?","In the Data Prep tool, use scripting (Python, JavaScript) to define custom transformations like aggregations or calculations."
"What is the maximum processing time for large datasets?","Processing time varies but typically takes 1-5 minutes for datasets up to 100 MB in the beta phase, depending on complexity."
"Can I use BluCygnus AI for customer lifetime value analysis?","Yes, upload customer purchase data, use predictive models to calculate CLV, and visualize trends in the dashboard."
"How do I monitor API performance?","In Developer Settings, view API call logs and response times to track performance and identify bottlenecks."
"What is the benefit of cloud-based processing?","Cloud-based processing ensures scalability, eliminates local hardware needs, and provides secure, high-speed data analysis."
"Can I use BluCygnus AI for real-time event monitoring?","Yes, connect to event streams via API, enable real-time mode, and visualize live event data for immediate insights."
"How do I create a custom AI model for my industry?","In the AI Models section, upload industry-specific data, select a model type, and fine-tune parameters for tailored predictions."
"What is the maximum number of concurrent users?","The beta free tier supports up to 10 concurrent users; enterprise plans will offer higher limits post-launch."
"Can I use BluCygnus AI for portfolio management?","Yes, upload investment data, use predictive models to assess returns or risks, and visualize portfolio performance."
"How do I handle data with complex relationships?","Use the Data Merge tool to join datasets with common keys, or apply graph-based models in the AI Models section for relational analysis."
"What is the benefit of automated insights in BluCygnus AI?","Automated insights highlight key trends or anomalies in your data, reducing manual analysis time and aiding quick decision-making."
"How do I set up a custom alert for system errors?","In the Automation tab, create a workflow with a system error trigger to send notifications via email or Slack."
"Can I use BluCygnus AI for logistics optimization?","Yes, upload logistics data, use predictive models to optimize routes or delivery schedules, and automate alerts for delays."
"How do I analyze user behavior data?","Upload user interaction data, use Behavioral Analysis tools to segment users, and visualize engagement patterns."
"What is the maximum number of custom metrics I can create?","The free tier allows up to 10 custom metrics; paid plans will support more, detailed post-launch."
"Can I use BluCygnus AI for churn prediction in subscriptions?","Yes, upload subscription data, apply predictive models to identify at-risk users, and visualize churn probabilities."
"How do I set up a dashboard for real-time monitoring?","Create a dashboard, enable Real-Time Mode, connect to a live data source, and add widgets for continuous updates."
"What is the benefit of multi-model AI analysis?","Multi-model analysis combines different AI models (e.g., regression, clustering) to provide comprehensive insights from complex datasets."
"How do I troubleshoot integration errors?","Check integration logs in the Integrations tab, verify credentials, and ensure API compatibility. Contact support if issues persist."
"Can I use BluCygnus AI for predictive pricing?","Yes, upload pricing and sales data, use predictive models to optimize pricing strategies, and visualize revenue impacts."
"How do I create a custom data pipeline?","In the Automation tab, chain multiple workflows (e.g., data import, cleaning, analysis) to create a custom pipeline."
"What is the maximum size for exported visualizations?","Visualizations are limited to 10 MB in the beta phase; use compressed formats or split outputs for larger files."
"Can I use BluCygnus AI for employee engagement analysis?","Yes, upload engagement survey data, use NLP or analytics tools to assess sentiment, and visualize trends."
"How do I set up a custom notification schedule?","In the Automation tab, create a workflow with a time-based trigger to send notifications at specific intervals."
"What is the benefit of data versioning in BluCygnus AI?","Data versioning tracks changes to datasets, enabling rollbacks or audits to ensure data integrity during collaboration."
"How do I analyze sales funnel performance?","Upload funnel data, use Analytics tools to track conversion rates, and visualize bottlenecks in the dashboard."
"Can I use BluCygnus AI for predictive maintenance in manufacturing?","Yes, upload machine sensor data, apply predictive models to forecast failures, and automate maintenance alerts."
"How do I create a shared workspace for my team?","In Team Settings, create a workspace, invite members, assign roles, and share projects or dashboards for collaboration."
"What is the maximum number of saved queries?","The free tier allows up to 20 saved queries; paid plans will offer higher limits post-launch."
"Can I use BluCygnus AI for real-time traffic analysis?","Yes, connect to traffic data APIs, enable real-time mode, and visualize patterns or predict congestion."
