question,answer
"How do I handle sensitive data securely?","Use encryption settings, anonymize sensitive fields in Data Prep, and restrict access via RBAC to ensure security."
"What is the benefit of automated report customization?","Automated report customization allows you to apply consistent branding and filters, saving time on recurring report generation."
"How do I analyze customer feedback from multiple channels?","Integrate channels like email or social media, upload feedback data, and use NLP to aggregate and analyze responses."
"Can I use BluCygnus AI for market trend analysis?","Yes, upload market data, use time-series or predictive models, and visualize trends to inform strategy."
"How do I set up a custom data export format?","In the Export section, define a custom format (e.g., CSV with specific columns) using scripting or templates."
"What is the maximum number of concurrent workflows?","The free tier supports up to 3 concurrent workflows; paid plans will allow more, detailed post-launch."
"Can I use BluCygnus AI for predictive sales territory planning?","Yes, upload territory and sales data, apply predictive models, and visualize optimal territory allocations."
"How do I create a custom dashboard widget?","In the dashboard editor, use the Custom Widget option to script (e.g., JavaScript) a tailored visualization."
"What is the benefit of AI-driven insights?","AI-driven insights automatically identify patterns, trends, or anomalies, enabling faster and more accurate decision-making."
"How do I set up a cross-project data sync?","In the Automation tab, create a workflow to sync data between projects using shared data sources or APIs."
"Can I use BluCygnus AI for predictive customer behavior analysis?","Yes, upload customer interaction data, apply behavioral models, and predict future actions like purchases or churn."
"How do I deploy a custom AI model to production?","In the AI Models section, train your model, validate its performance, and use the API to deploy it for real-time predictions."
"Can I monitor the performance of deployed AI models?","Yes, in the AI Models section, view real-time metrics like prediction accuracy or latency to ensure model reliability."
"How do I use BluCygnus AI for retail inventory optimization?","Upload inventory and sales data, apply predictive models to forecast demand, and automate reorder alerts for efficient stock management."
"Can I integrate BluCygnus AI with Tableau?","Tableau integration is planned for the live site. In beta, export data as CSV or use the API to connect with Tableau."
"How do I handle high-frequency data streams?","Connect high-frequency streams via API, enable Real-Time Mode, and optimize processing by filtering or aggregating data in the Data Prep tool."
"What is the benefit of automated model retraining?","Automated model retraining keeps AI models accurate by periodically updating them with new data, configured in the AI Models section."
"How do I create a custom user onboarding guide?","In the Help Center, use the template editor to create a tailored guide with steps for your team’s specific use cases."
"Can I use BluCygnus AI for supply chain risk analysis?","Yes, upload supply chain data, apply risk assessment models, and visualize potential disruptions in the dashboard."
"How do I set up a custom data validation rule?","In the Data Prep tool, define rules (e.g., range checks, format validation) using scripting or predefined templates."
"What is the maximum number of custom templates I can save?","The free tier allows up to 5 custom templates for dashboards or reports; paid plans will offer higher limits post-launch."
"Can I use BluCygnus AI for educational data analysis?","Yes, upload student or institutional data, analyze metrics like performance or attendance, and predict outcomes like graduation rates."
"How do I optimize dashboard performance for large teams?","Limit widgets, use cached data, and schedule updates during off-peak hours to ensure smooth performance for large teams."
"What is the benefit of audit logs in BluCygnus AI?","Audit logs track user actions (e.g., data edits, logins) in Team Settings, ensuring transparency and security for collaborative projects."
"How do I analyze multi-channel marketing performance?","Integrate channels like Google Ads or social media, upload campaign data, and compare metrics like conversions in a unified dashboard."
"Can I use BluCygnus AI for predictive maintenance in energy systems?","Yes, upload energy system data, apply predictive models to detect potential failures, and automate maintenance schedules."
"How do I create a custom API endpoint?","In Developer Settings, use the API builder to define custom endpoints for specific data or model outputs, per the documentation."
"What is the maximum number of visualizations per dashboard?","The free tier supports up to 10 visualizations per dashboard; paid plans will allow more, detailed post-launch."
"Can I use BluCygnus AI for real-time supply chain monitoring?","Yes, connect to supply chain APIs, enable real-time mode, and visualize inventory or logistics updates instantly."
"How do I set up a custom error handling workflow?","In the Automation tab, create a workflow to detect errors (e.g., failed uploads) and trigger custom actions like notifications or retries."
"What is the benefit of cross-platform data integration?","Cross-platform integration unifies data from multiple sources (e.g., CRM, ERP), enabling holistic analysis and automation."
"How do I analyze employee productivity metrics?","Upload timesheet or task data, use analytics tools to measure productivity, and visualize trends in the dashboard."
"Can I use BluCygnus AI for predictive demand in retail?","Yes, upload sales and customer data, apply forecasting models, and optimize stock levels based on predicted demand."
"How do I create a custom data aggregation rule?","In the Data Prep tool, use scripting to define aggregation rules (e.g., sum, average) for specific columns or datasets."
"What is the maximum number of concurrent API calls?","The free tier supports up to 5 concurrent API calls; paid plans will offer higher limits post-launch."
"Can I use BluCygnus AI for real-time fraud monitoring?","Yes, connect to transaction streams via API, apply anomaly detection models, and visualize suspicious activities in real time."
"How do I set up a custom user role?","In Team Settings, create a custom role with specific permissions (e.g., view-only analytics) for tailored access control."
"What is the benefit of automated data validation?","Automated data validation ensures data quality by catching errors or inconsistencies before analysis, improving efficiency and accuracy."
"How do I analyze customer retention trends?","Upload customer data, use time-series analysis to track retention rates, and predict future churn with AI models."
"Can I use BluCygnus AI for blockchain data analysis?","Yes, upload blockchain transaction data via API, analyze patterns, and visualize trends for insights like fraud detection."
"How do I optimize AI model training time?","Reduce dataset size, select efficient algorithms, and use cloud-based processing to speed up training in the AI Models section."
"What is the maximum number of projects I can create?","The free tier allows up to 5 projects; paid plans will support more, detailed post-launch."
"Can I use BluCygnus AI for real-time weather data analysis?","Yes, connect to weather APIs, enable real-time mode, and visualize forecasts or trends for applications like agriculture."
"How do I set up a custom data encryption key?","Enterprise users can contact sales@blucygnus.ai to set up customer-managed encryption keys for enhanced data security."
"What is the benefit of scalable cloud infrastructure?","Scalable cloud infrastructure ensures the platform handles growing data volumes and user loads without performance degradation."
"How do I analyze social media engagement trends?","Integrate with platforms like Twitter, upload engagement data, and use analytics tools to track metrics like likes or shares."
"Can I use BluCygnus AI for predictive analytics in healthcare?","Yes, upload anonymized patient data, apply predictive models for outcomes like readmissions, and ensure HIPAA compliance."
"How do I create a custom notification template?","In the Automation tab, design a notification template with custom text, variables, and branding for consistent alerts."
"What is the maximum number of data exports per month?","The free tier allows up to 10 data exports per month; paid plans will offer higher limits post-launch."
"Can I use BluCygnus AI for real-time inventory tracking?","Yes, connect to inventory systems via API, enable real-time mode, and visualize stock levels or trigger reorder alerts."
"How do I set up a custom data import schedule?","In the Automation tab, create a workflow to pull data from integrated sources (e.g., Google Drive) at specific intervals."
"What is the benefit of predictive analytics for startups?","Predictive analytics helps startups optimize resources, forecast growth, and identify market opportunities with limited budgets."
"How do I analyze customer satisfaction metrics?","Upload survey or feedback data, use NLP for sentiment analysis, and visualize satisfaction trends in the dashboard."
"Can I use BluCygnus AI for edge computing integration?","Edge computing support is planned for future releases. In beta, use APIs to process data locally and sync with the cloud."
"How do I create a custom analytics dashboard for executives?","In the dashboard editor, select Executive Summary template, add key metrics, and customize visuals for high-level insights."
"What is the maximum number of team workspaces?","The free tier supports 1 workspace; paid plans will allow multiple workspaces, detailed post-launch."
"Can I use BluCygnus AI for predictive maintenance in transportation?","Yes, upload vehicle sensor data, apply predictive models to forecast maintenance needs, and automate alerts for fleet management."
"How do I set up a custom data retention policy?","Enterprise users can contact support@blucygnus.ai to define custom retention periods for compliance or storage needs."
"What is the benefit of automated anomaly detection?","Automated anomaly detection identifies outliers in data (e.g., fraud, errors) without manual review, improving efficiency and accuracy."